{
  "schemaVersion": 1,
  "contentVersion": "2026.10.21-v1",
  "locale": "id-ID",
  "title": "ReThink SMA diagnostic starter bank",
  "authorship": "original-rethink",
  "status": "draft",
  "difficultyScale": {
    "1": "entry",
    "2": "routine",
    "3": "application-or-reasoning"
  },
  "sources": [
    {
      "id": "cp-math-2025",
      "title": "Panduan Mata Pelajaran Matematika 2025",
      "url": "https://repositori.kemendikdasmen.go.id/33608/",
      "alignmentStatus": "topic-level-indexed-official-excerpts",
      "note": "General sections 5–6; Advanced sections 1–4. Full section-level review pending."
    },
    {
      "id": "rethink-prerequisites",
      "title": "ReThink prerequisite design",
      "url": null,
      "alignmentStatus": "proposed-prerequisites",
      "note": "Foundational content supports SMA readiness; not a claim of separate SMA CP requirements."
    }
  ],
  "topics": [
    {
      "id": "f-integers",
      "title": "Bilangan bertanda dan urutan operasi",
      "phase": "foundation",
      "track": "foundation",
      "prerequisites": [],
      "alignment": {
        "sourceId": "rethink-prerequisites",
        "section": "signed arithmetic"
      }
    },
    {
      "id": "f-fractions",
      "title": "Pecahan dan desimal",
      "phase": "foundation",
      "track": "foundation",
      "prerequisites": [
        "f-integers"
      ],
      "alignment": {
        "sourceId": "rethink-prerequisites",
        "section": "fractions"
      }
    },
    {
      "id": "f-ratios",
      "title": "Rasio dan proporsi",
      "phase": "foundation",
      "track": "foundation",
      "prerequisites": [
        "f-fractions"
      ],
      "alignment": {
        "sourceId": "rethink-prerequisites",
        "section": "ratios"
      }
    },
    {
      "id": "f-percentages",
      "title": "Persentase dan perubahan relatif",
      "phase": "foundation",
      "track": "foundation",
      "prerequisites": [
        "f-ratios"
      ],
      "alignment": {
        "sourceId": "rethink-prerequisites",
        "section": "percentages"
      }
    },
    {
      "id": "f-distribution",
      "title": "Sifat distributif dan suku sejenis",
      "phase": "foundation",
      "track": "foundation",
      "prerequisites": [
        "f-integers"
      ],
      "alignment": {
        "sourceId": "rethink-prerequisites",
        "section": "algebraic manipulation"
      }
    },
    {
      "id": "f-linear-equations",
      "title": "Persamaan linear dan operasi invers",
      "phase": "foundation",
      "track": "foundation",
      "prerequisites": [
        "f-distribution",
        "f-fractions"
      ],
      "alignment": {
        "sourceId": "rethink-prerequisites",
        "section": "linear equations"
      }
    },
    {
      "id": "f-coordinates",
      "title": "Koordinat dan gradien garis",
      "phase": "foundation",
      "track": "foundation",
      "prerequisites": [
        "f-linear-equations"
      ],
      "alignment": {
        "sourceId": "rethink-prerequisites",
        "section": "coordinates"
      }
    },
    {
      "id": "f-pythagoras",
      "title": "Segitiga siku-siku dan akar",
      "phase": "foundation",
      "track": "foundation",
      "prerequisites": [
        "f-fractions"
      ],
      "alignment": {
        "sourceId": "rethink-prerequisites",
        "section": "geometry prerequisites"
      }
    },
    {
      "id": "e-exponents",
      "title": "Eksponen bulat dan pecahan",
      "phase": "E",
      "track": "general",
      "prerequisites": [
        "f-fractions"
      ],
      "alignment": {
        "sourceId": "cp-math-2025",
        "section": "5.1"
      }
    },
    {
      "id": "e-inequalities",
      "title": "Sistem pertidaksamaan linear dua variabel",
      "phase": "E",
      "track": "general",
      "prerequisites": [
        "f-linear-equations",
        "f-coordinates"
      ],
      "alignment": {
        "sourceId": "cp-math-2025",
        "section": "5.2"
      }
    },
    {
      "id": "e-quadratic-roots",
      "title": "Persamaan kuadrat dan akar kompleks",
      "phase": "E",
      "track": "general",
      "prerequisites": [
        "f-distribution",
        "f-linear-equations"
      ],
      "alignment": {
        "sourceId": "cp-math-2025",
        "section": "5.2"
      }
    },
    {
      "id": "e-quadratic-graphs",
      "title": "Grafik dan nilai ekstrem fungsi kuadrat",
      "phase": "E",
      "track": "general",
      "prerequisites": [
        "e-quadratic-roots",
        "f-coordinates"
      ],
      "alignment": {
        "sourceId": "cp-math-2025",
        "section": "5.2"
      }
    },
    {
      "id": "e-exponential-functions",
      "title": "Persamaan dan fungsi eksponensial",
      "phase": "E",
      "track": "general",
      "prerequisites": [
        "e-exponents",
        "f-coordinates"
      ],
      "alignment": {
        "sourceId": "cp-math-2025",
        "section": "5.2"
      }
    },
    {
      "id": "e-trigonometry",
      "title": "Perbandingan trigonometri sudut lancip",
      "phase": "E",
      "track": "general",
      "prerequisites": [
        "f-pythagoras",
        "f-ratios"
      ],
      "alignment": {
        "sourceId": "cp-math-2025",
        "section": "5.3"
      }
    },
    {
      "id": "e-quartiles",
      "title": "Kuartil dan jangkauan interkuartil",
      "phase": "E",
      "track": "general",
      "prerequisites": [
        "f-fractions"
      ],
      "alignment": {
        "sourceId": "cp-math-2025",
        "section": "5.4"
      }
    },
    {
      "id": "e-data-displays",
      "title": "Representasi data dan evaluasi laporan",
      "phase": "E",
      "track": "general",
      "prerequisites": [
        "e-quartiles"
      ],
      "alignment": {
        "sourceId": "cp-math-2025",
        "section": "5.4"
      }
    },
    {
      "id": "e-scatterplots",
      "title": "Diagram pencar dan hubungan numerik",
      "phase": "E",
      "track": "general",
      "prerequisites": [
        "f-coordinates"
      ],
      "alignment": {
        "sourceId": "cp-math-2025",
        "section": "5.4"
      }
    },
    {
      "id": "g-arithmetic-sequences",
      "title": "Barisan dan deret aritmetika",
      "phase": "F",
      "track": "general",
      "prerequisites": [
        "f-linear-equations"
      ],
      "alignment": {
        "sourceId": "cp-math-2025",
        "section": "6.1"
      }
    },
    {
      "id": "g-geometric-sequences",
      "title": "Barisan dan deret geometri",
      "phase": "F",
      "track": "general",
      "prerequisites": [
        "e-exponents"
      ],
      "alignment": {
        "sourceId": "cp-math-2025",
        "section": "6.1"
      }
    },
    {
      "id": "g-interest",
      "title": "Bunga tunggal dan majemuk",
      "phase": "F",
      "track": "general",
      "prerequisites": [
        "f-percentages",
        "g-geometric-sequences"
      ],
      "alignment": {
        "sourceId": "cp-math-2025",
        "section": "6.1"
      }
    },
    {
      "id": "g-annuities",
      "title": "Anuitas dan model pinjaman",
      "phase": "F",
      "track": "general",
      "prerequisites": [
        "g-interest"
      ],
      "alignment": {
        "sourceId": "cp-math-2025",
        "section": "6.1"
      }
    },
    {
      "id": "g-functions",
      "title": "Fungsi, domain, dan evaluasi",
      "phase": "F",
      "track": "general",
      "prerequisites": [
        "f-coordinates"
      ],
      "alignment": {
        "sourceId": "cp-math-2025",
        "section": "6.2"
      }
    },
    {
      "id": "g-composition",
      "title": "Komposisi fungsi",
      "phase": "F",
      "track": "general",
      "prerequisites": [
        "g-functions",
        "f-distribution"
      ],
      "alignment": {
        "sourceId": "cp-math-2025",
        "section": "6.2"
      }
    },
    {
      "id": "g-inverse-functions",
      "title": "Fungsi invers dan pembatasan domain",
      "phase": "F",
      "track": "general",
      "prerequisites": [
        "g-functions",
        "f-linear-equations"
      ],
      "alignment": {
        "sourceId": "cp-math-2025",
        "section": "6.2"
      }
    },
    {
      "id": "g-transformations",
      "title": "Transformasi fungsi",
      "phase": "F",
      "track": "general",
      "prerequisites": [
        "g-functions",
        "e-quadratic-graphs"
      ],
      "alignment": {
        "sourceId": "cp-math-2025",
        "section": "6.2"
      }
    },
    {
      "id": "g-circles",
      "title": "Unsur dan hubungan dalam lingkaran",
      "phase": "F",
      "track": "general",
      "prerequisites": [
        "e-trigonometry"
      ],
      "alignment": {
        "sourceId": "cp-math-2025",
        "section": "6.3"
      }
    },
    {
      "id": "g-bivariate-statistics",
      "title": "Asosiasi, regresi, dan sebab-akibat",
      "phase": "F",
      "track": "general",
      "prerequisites": [
        "e-scatterplots",
        "f-percentages"
      ],
      "alignment": {
        "sourceId": "cp-math-2025",
        "section": "6.4"
      }
    },
    {
      "id": "g-counting",
      "title": "Pencacahan, permutasi, dan kombinasi",
      "phase": "F",
      "track": "general",
      "prerequisites": [
        "f-integers"
      ],
      "alignment": {
        "sourceId": "cp-math-2025",
        "section": "6.4"
      }
    },
    {
      "id": "g-compound-probability",
      "title": "Peluang majemuk dan frekuensi harapan",
      "phase": "F",
      "track": "general",
      "prerequisites": [
        "g-counting",
        "f-fractions"
      ],
      "alignment": {
        "sourceId": "cp-math-2025",
        "section": "6.4"
      }
    },
    {
      "id": "g-conditional-probability",
      "title": "Peluang bersyarat dan independensi",
      "phase": "F",
      "track": "general",
      "prerequisites": [
        "g-compound-probability"
      ],